{
  "components": [
    {
      "category": "Extractor",
      "executor": {
        "type": "http_request"
      },
      "id": "extract_pm25",
      "inputs": [],
      "integrations_used": [
        "pm25_api"
      ],
      "name": "Extract PM2.5",
      "outputs": [],
      "retry": {
        "delay_seconds": 30,
        "max_attempts": 2,
        "strategy": "constant"
      },
      "upstream_policy": "all_success"
    },
    {
      "category": "QualityCheck",
      "executor": {
        "type": "python_script"
      },
      "id": "validate_threshold",
      "inputs": [],
      "integrations_used": [
        "pm25_api"
      ],
      "name": "Validate Threshold",
      "outputs": [],
      "retry": {
        "delay_seconds": 30,
        "max_attempts": 2,
        "strategy": "constant"
      },
      "upstream_policy": "all_success"
    }
  ],
  "description": "Check PM2.5 and alert",
  "flow": {
    "edges": [
      {
        "edge_type": "success",
        "from": "extract_pm25",
        "to": "validate_threshold"
      }
    ],
    "entry_points": [
      "extract_pm25"
    ],
    "pattern": "sequential"
  },
  "integrations": [
    {
      "authentication": {
        "method": "token",
        "secret_ref": "PM25_API_KEY"
      },
      "direction": "input",
      "id": "pm25_api",
      "name": "PM API",
      "type": "api",
      "used_by_components": [
        "extract_pm25",
        "validate_threshold"
      ]
    }
  ],
  "metadata": {
    "complexity": "low",
    "created": "2025-10-11",
    "domain": "general",
    "generator": "template",
    "name": "pm25_alert_pipeline",
    "owner": "unknown"
  },
  "orchspec_version": "1.0",
  "pipeline_id": "pm25_alert_pipeline",
  "provenance": {
    "generated_at": "2025-10-11T08:00:00Z",
    "original_name": "pm25_alert_pipeline",
    "source_file": "pm25.txt",
    "source_type": "step1_json"
  },
  "schedule": {
    "enabled": false
  },
  "secrets": [
    {
      "name": "PM25_API_KEY",
      "required_by_component": "extract_pm25"
    }
  ]
}
